{
  "schema_version": 1,
  "policy_id": "66666666-6666-4666-8666-666666666666",
  "policy_version": 1,
  "subject_id": "11111111-1111-4111-8111-111111111111",
  "effect": "allow",
  "enabled": true,
  "capability_ids": [
    "playlist.write"
  ],
  "actor_types": [
    "agent",
    "user"
  ],
  "actor_refs": [
    {
      "actor_type": "agent",
      "actor_id": "99999999-9999-4999-8999-999999999999"
    },
    {
      "actor_type": "user",
      "actor_id": "11111111-1111-4111-8111-111111111111"
    }
  ],
  "surfaces": [
    "surface.chat"
  ],
  "account_refs": [
    {
      "system": "synthetic-stream",
      "entity_type": "account.music",
      "external_id": "account-example-001"
    }
  ],
  "allowed_execution_modes": [
    "dry_run",
    "execute"
  ],
  "allowed_effects": [
    "read_external",
    "write_external",
    "use_credentials"
  ],
  "risk_limits": [
    {
      "domain": "privacy",
      "max_level": "medium"
    },
    {
      "domain": "account",
      "max_level": "medium"
    },
    {
      "domain": "copyright",
      "max_level": "low"
    },
    {
      "domain": "spend",
      "max_level": "none"
    }
  ],
  "privacy": {
    "purpose_id": "purpose.playlist_curation",
    "purpose": "Create a user-approved playlist from profile evidence.",
    "allowed_data_classes": [
      "public_metadata",
      "personal_profile"
    ],
    "allowed_destinations": [
      {
        "destination_type": "external",
        "system": "synthetic-stream",
        "purpose_id": "purpose.playlist_write",
        "purpose": "Write the approved playlist."
      }
    ],
    "raw_data_egress_allowed": false,
    "rights_basis_required": true,
    "retention_days": 30
  },
  "confirmation": {
    "mode": "always",
    "scope": "invocation",
    "ttl_seconds": 600,
    "max_uses": 1
  },
  "budgets": [],
  "idempotency": {
    "required_for": [
      "write_external"
    ],
    "key_ttl_seconds": 86400
  },
  "retry": {
    "max_attempts": 2,
    "backoff": "exponential",
    "base_delay_ms": 500,
    "retryable_categories": [
      "rate_limit",
      "external_service"
    ]
  },
  "timeout_seconds": 30,
  "escalate_on": [
    "approval_expired",
    "authentication_required",
    "ambiguous_intent",
    "unknown_outcome"
  ],
  "audit": {
    "required": true,
    "redact_argument_paths": [
      "/credentials"
    ],
    "redact_result_paths": [
      "/provider_payload"
    ],
    "retention_days": 90
  },
  "valid_from": "2026-08-23T09:00:00Z",
  "valid_until": "2026-09-23T09:00:00Z",
  "priority": 100
}
